196342144749944832	1	Chi paragona i #Pirati a #Grillo e mette tutto nel calderone dell'antipolitica o non conosce la politica tedesca o è un giornalista italiano
165029712501018624	1	Difendere Mario Monti sta diventando più impegnativo che difendere i Killers dagli indie hipsters.
291839009024507904	2	Hello Summer, un gruppo francese edito dai nostri amici della Coraline Records... http://t.co/hJLc4Y2j
391936441175248896	2	RT @contropiano: Anche il Portogallo in piazza contro l'austerity #contropiano http://t.co/r6tBmqNWdn http://t.co/j5P1fOsyvv
160669160832114690	0	Vai così super Mario #Monti! Non mollare !
291940897870979072	2	Dead or Alive 5+ accetta la sfida su PS Vita a marzo http://t.co/3kZXempW
165524864822804480	1	Sei monotono, la gente cambia, il mondo si evolve, solo tu resti il solito stronzo. Cit di Mario #Monti in un dialogo con il #PostoFisso
147372355759513600	1	Santi (Prc Marsciano): Sabato in piazza contro il governo Monti | umbrialeft.it http://t.co/8YPudBNV
134710798294593536	1	@riotta Si è dimesso Bini Smaghi il futuro prof a Harvard o Bini Smaghi il futuro ministro dell'economia del governo Monti?
391997183710728192	2	Melli fa tanto giocatore anni 70
288388206880243712	1	Se guardate Little Things e poi Kiss You...bhe vi renderete conto di quanto siano da curare. Non sembrano nemmeno le stesse persone.
192141875975688192	2	@SkyTg24 #Grillo dacci un giudizio netto su #Monti. E dicci c'è una forza politica con la quale faresti alleanze? Di Pietro sì o no?
143811938210680832	2	#Equità e #giustizia sociale? La #Manovra del #governo #Monti è in continuità con la politica del precedente Esecutivo
393386622277787648	2	Il link inviato alle aziende da http://t.co/2a7mE9UUxS è in html, in PEC non funziona e non è testuale quindi copia-incolla non possibile.
146264270693339136	2	#Sondaggio Quale partito ha più peso politico nel governo #Monti? Di la tua... http://t.co/9EzV7RTK
193105327900733440	1	#Grillo ha rotto con la sua presunzione di essere il migliore di tutti. E' solo una vanna marchi che al posto dei legnetti vende battutine
142335907083714561	1	governo monti, la fabbrica della povertà'. titolo della Padania di domani
136104360135491585	2	http://t.co/hY6ZjNZv siamo sicuri che al PD convenga il governo Monti, in termini elettorali, come sostiene @pietroraffa? #oramonti
155221375609602048	2	Calderoli ne vuole ancora: A Roberto Calderoli non è bastata la sarcastica risposta di Mario Monti riguardo la s... http://t.co/JMvLRCak
295262039616659457	2	Ah si ho capito bene si, si chiama Liam. LOL.
142263500448874496	2	Gentile professor Monti http://t.co/iNU6rXrK
154640297631035392	2	MARIO MONTI SI DIMETTERA'? INTERESSI PRIVATI SODDISFATTI A SPESE DEGLI ITALIANI? http://t.co/NWVwj95a
143627663758725120	2	Varata la #manovra finanziaria firmata #governo Monti. Leggi quali sono le decisioni più importanti e di' cosa ne pensi http://t.co/EMzE25F6
287568918439161856	2	cosa ti ha fatto stare male? — che l'abbia messa come copertina. http://t.co/f0SGD6zQ
393246827820376064	2	Tennis, Simona Halep: si riduce il seno e vince cinque tornei. Foto http://t.co/2W3HF3lEZK
396657958329012225	1	È la verità :((((
291958845784326144	2	Tutto Android - Sony Xperia Z ufficiale a 649€ in Italia a Marzo: Con comunicazione al quanto ufficiale, il... http://t.co/KkkPtbgU
193475405653622785	0	@pino_fasulo @valy_s #Grillo presta la sua faccia: ciò che altri non fanno. Non troviamo la macchia su tutto quando non c'è. #ultimaparola
391965196782407681	0	GIUSTO DOBBIAMO FARE LORO LA DANZA DELLA PIOGGIA COSI' SONO CONTENTI..............!!!!!!!!!!!! http://t.co/hQZ4qWGbVu
391842317537386496	0	RT @I_live_to_read: 'Noi Potterheads' pt 8 MA QUANT'È BELLA??! NO, MA DICO IO, QUANT'È BELLA??!! http://t.co/D0GSmWIy29
188731878566662147	0	@Giulsxx notte,grazie per aver parlato con me.
286121147324583937	2	@Tomlinson_off comunque i miei sono i oned, demi e ed, ma amo anche justin e gli union j c:
142855998296698880	2	Oggi all' #assemblea sarà la #cgil e i suoi 15 mila delegati a parlare di #crescita e di #equità nel #lavoro... professor #Monti ascolti
136965195670093824	1	Teledurruti Governo Monti mi stai già sul cazzo! http://t.co/CXOCGTYm
142670764909400065	2	Il Governo #Monti è di emergenza, dovremo quanto prima tornare al voto senza #porcellum. Chi nega tale priorità lo fa per proprio tornaconto
142996265091862529	2	Marcolini: Domani la cultura diventi l'ottavo punto dell'agenda del governo monti.#fabbricadicultura
161791388801966080	2	Governo. Monti vuole abolire valore legale della Laurea. Tutti gli aggiornamenti http://t.co/EGIUamk5
146954467890298881	2	Stasera conduzione tecnica del tg di La7: al posto di #Mentana condurrà Mario Monti
137156168261959680	0	Il discorso di Mario Monti al Senato è stato così serio e politico come mai ne ho visti nei miei 18 Anni di vita.
195458985162326016	1	Ci si concentra su #Grillo e non su tutto il consenso che guadagna, sintomatico di un popolo che vuole risposte da una politica che non c'è
154659816705503233	0	Grande Mario Monti #cotechinoelenticchie
193306360824332289	2	C'È ANCORA GENTE FERMAMENTE CONVINTA CHE 'LEGO HOUSE' SIA CANTATA DA RON DI HARRY POTTER. #chetristezza
393338372816506880	2	@StefanoDeBiase1 Grazie x il follower. Per info e prenotazione della #donazionesangue telefona 0574-23793 o lascia un messaggio
134639252007952385	2	"Mario Monti alla guida del Governo? Berlusconi: ""scelta... MNews.IT http://t.co/SlQFCVOz"
195604733296254977	2	"#Grillo contro #Napolitano: \""Presidente della Repubblica? No, presidente dei partiti\"" http://t.co/mWgXDrt9"
151622593533845504	2	Leggete 'Denunciato Mario Monti per alto tradimento video' di Redazione Cadoinpiedi.it @Cadoinpiedi http://t.co/GBxlQPsL
195602424227041283	0	#serviziopubblico tutto condivisibile,ma nessuno parla di signoraggio bancario,ecco perchè #Grillo avanza,perchè è in contatto con la realtà
162855912573382656	2	Il CSI Piemonte deve cambiare: lo dice Mario Monti http://t.co/Awmdlr87
195977096198242304	2	@xellenlovieber si ma non guido D: ancora non sono proprio pratica anche perchè ce l'ho da poco.. e poi non so dove abita perchè non ci --
195648043872301056	0	@marcelloscurria Ben detto condivido e danno a #Grillo anche ottimi assist come #rimborsielettorali che #M5S rifiuta e ora le 400 #autoblu
292994879351558144	2	harry e tay sarebbero venuti in italia.
192658864158687232	1	L'#antipolitica sa essere anche più noiosa della #politica. #Stereotipi #Grillo #Demagogia #Populismo
195912736021028864	2	#Grillo all'8%   ............ un doveroso grazie ai vari #Napolitano , #Bersani , #Vendola , #Alemanno ,#Libero ,#IL Giornale , ecc. ecc.
138744589195554816	2	Sono lieto di comunicarvi che il governo Monti ha un effetto decisamente positivo sullo spread tra la mia squadra di calcetto e le altre
144108301146259456	1	Ecco tutti i privilegi della Casta che il premier non ha tagliato mario monti, casta, sprechi, cam http://t.co/cC66qcHC
196287340518440962	1	E' ufficiale. #Grillo si considera il nuovo #Bossi: insulti a partiti e media, demagogia dura e pura. Della #politica vera neanche l'ombra
149049989744701440	2	Vedo in giro un sacco di belle discussioni e trasmissioni sul governo Monti. Qui il problema è che il debito... http://t.co/XZSB7kZy
133976159649148928	2	@politicaevalori secondo Lei cosa sarebbe meglio ?! governo Monti o elezioni (pur con il porcellum) ?
395629389511413760	0	Dormi patata....... @ casa mia http://t.co/9Qc89orQWS
287572148619456512	0	#nonsipuòodiare @DioJavier Ti stimo troppo! Sei la mia vita credimi. Ahahah.
161180078695399424	1	#Mauro ha ragione sulla #Lega. se sono stanchi di #Formigoni devono cacciarlo e basta, non solo se cade il governo #Monti. opportunisti
147439872100139009	2	Smentita dal Governo #Monti: aumentano solo le accise sul tabacco trinciato. Meno male che non mi fo le sigarette e non fumo la pipa...
393492372648382464	0	@ALetterOfMarque @Fascinatingpics Che bello...:-))))
164796526630141952	0	#Renzi Spero che il governo Monti arrivi fino alla fine della legislatura #ottoemezzo
135236915032109056	0	Ore decisive per il Governo anticrisi: Mario Monti, accolto da un applauso all' ingresso in aula a Palazzo Madam... http://t.co/15YkmzIA
391972737859596288	0	voglio fare sesso:*
294842824397033473	2	#FF quando sono in Italia, si beve vino e ballare per sempre in pois = @markosoma
143739235038527488	1	La tragedia di un governo Monti ridicolo http://t.co/rbzHGyaC #economia #politica #evasionefiscale #fisco
193077781058437120	0	#Grillo non sarà uno statista, ma è il benvenuto se ci aiuta a fare #piazzapulita di tutti questi politici parassiti.
146941410011136000	2	Il governo #Monti fa retromarcia http://t.co/6OBUC9Zj
164735374206316544	0	Lo stile comunicativo di Mario #Monti ed il suo team convince i professionisti delle Relazioni Pubbliche http://t.co/TmD9u97F
144840767490375680	2	La prova definitiva che il governo #Monti é rock http://t.co/VvarCtUv
165226854716940288	1	mario monti.. senatore a vita..piu posto fisso di cosi'..si muore.#postofisso
193102555457400832	1	#Grillo ci salverà tutti?Ma come si può dar seguito ad uno che basa tutte le sue idee solo sulla critica degli altri partiti? #piazzapulita
134955792263692289	0	Se il medico dev'essere Mario Monti, sia: ma con uno staff adeguato. Altrimenti meglio cambiare ospedale. http://t.co/ZmLS4xO4 via @ilpost
145967351353966593	1	Basta privilegi, basta vitalizi, la politica deve essere una passione, non un lavoro strapagato. #crisi #governo #monti
190424590793703425	1	@ani1202 no no nn sono tutti uguali. 1 su un milione e' diverso :-)) anziché la barba, ha i baffi 😂😂😂
190764915760431104	1	#Grillo in parlamento sarebbe la morte più triste della politica seria. I buffoni di solito si esibiscono al circo.
146266543158870016	1	Domenica prossima a Roma #LaDestra farà partire la mobilitazione popolare contro il governo Monti... http://t.co/riTiG08S
145930009188634625	2	Dedicato al governo Monti http://t.co/ISXVgDXH
145533766109114368	2	FACEBOOK:ISCRIVETEVI AL GRUPPO Governo Mario Monti per il 150° anniversario dell'unità d'Italia, venite a conos. questa nuova piatt. polit.!
288701300114333696	2	Sono un giocatore della slot machine Nato per essere ricco http://t.co/rasJ77M6 http://t.co/AmMvj9Ld
136782919967571968	1	@palazzochigi Professor Monti, c'è una certa attesa per la lista #ministri. Senza fretta, però tenga conto della nostra ansia..
291890639149342722	0	Dopo i balzi di ieri e il #superLento di oggi il tendine sta bene! Ora #carneBianca per le fibre bianche!!!!
148892409835696129	2	Direzione Pd Forlí: tanti interventi contro il Governo Monti. Ma possibile che non abbiamo compreso la situazione? Povero Bersani.
190163175205908480	2	Tra la #Guzzanti e #Grillo c'è solo una differenza di medium: da internet alla cara, vecchia tv. Ma la traducono in maniera uguale: tribuna.
296703942631501827	2	..uff, ieri ho sognato niall e zayn, stavo in un nego... — ahahahhaha awl'ultimo sogno che ho fatto su di loro ... http://t.co/sqbaNHII
192725381663563776	0	@EstremoCentro @pierferdinando #Grillo stasera #Desenzanodelgarda ha fatto il pieno io dico che travolgerà molti partiti la gente e' stanca!
391810937604550656	1	RT @alonegjrl: mia mamma rompe troppo a momenti devo chiederle anche il permesso di respirare,ma vaffanculo
152793943732535298	2	#Mario Monti denunciato 24-12-2011 http://t.co/KhgxSasp via @youtube
287996179600515072	2	@MelaniaRizzoli ...sotto lo sguardo inceneritore della moglie 😝
142635371962961920	1	Mario Monti da Vespa per presentare la manovra: è polemica http://t.co/LXW8ZBhZ #notizie #politica
137125328756801536	1	Il Governo #Monti è perfetto per arrivare fino alle vacanze di Natale. #manifestazione studenti
192342686261452800	2	Nn posso fare a meno di pensare ad un terzino sx del foggia ai tempi di zeman quando ti vedo #quasi30anni
136817727678590977	1	Speriamo che il governo Monti duri poco perchè Gnudi non ci arriva al 2013. #ministri
137608248713949184	1	Con la fiducia al #governo #Monti la classe #politica ha certificato la sua incapacità di saper governare l' #Italia #opencamera #pdl #pd
290459044454473728	1	Sei un grande francesco!!! Tu che hai fatto x factor ma la Ventura davvero capisce di musica O.o ho i miei dubbi!!
195609057292324864	0	@Porticelli85 per come i giornalisti hanno trattato #Grillo fino ad oggi..FA BENE!
186361594048028673	1	@Gaia_Belieber99 anche io,ci ho sperato fino alla fine...
136789941102452737	0	In bocca al lupo Professor Monti... Buon lavoro! #oramonti #berlusconifuoridaicoglioni
